Authors,Author(s)ID,Title,Year,Sourcetitle,Volume,Issue,Art.No.,Pagestart,Pageend,Pagecount,Citedby,DOI,Link,DocumentType,PublicationStage,AccessType,Source,EID
"Battersby, J.",57189430325,The recent epidemic of typhoid fever in south africa,1901,British Medical Journal,1,2111,,1521,,,,10.1136/bmj.1.2111.1521-a,https://www.scopus.com/inward/record.url?eid=2-s2.0-84970814279&partnerID=40&md5=8d53a4db0dd56b65bca00b81ac2c15e7,Letter,Final,,Scopus,2-s2.0-84970814279
"Thomson, F.",57189118610,“Oral sepsis” in scarlet fever,1906,British Medical Journal,1,2357,,534,535,,,10.1136/bmj.1.2357.534-a,https://www.scopus.com/inward/record.url?eid=2-s2.0-84965219744&partnerID=40&md5=72d2f87d3df7f3a4c7fc939c0c930fef,Letter,Final,,Scopus,2-s2.0-84965219744
"Brid, W.D.",57067161300,A Company of Russian Machine Guns at the Battle of Liao-Yang,1906,Royal United Services Institution. Journal,50,346,,1498,1503,,,10.1080/03071840609431330,https://www.scopus.com/inward/record.url?eid=2-s2.0-84954899083&partnerID=40&md5=9e06a3cb3ba7b1eca7f64045d568ce09,Article,Final,,Scopus,2-s2.0-84954899083
"Jones, B.M.",23076847500,CLXIX. - The spontaneous crystallisation of solutions of some alkali nitrates,1908,"Journal of the Chemical Society, Transactions",93,,,1739,1747,,2,10.1039/CT9089301739,https://www.scopus.com/inward/record.url?eid=2-s2.0-37049152660&partnerID=40&md5=03cb29481848e72957e9f0c97ad83eaf,Review,Final,,Scopus,2-s2.0-37049152660
"Hemmy, A.S.",36964532600,The earth and comets' tails [5],1910,Nature,83,2120,,459,,,,,https://www.scopus.com/inward/record.url?eid=2-s2.0-51149133856&partnerID=40&md5=bd346b8ffdae2a89acf63914db0f6873,Letter,Final,,Scopus,2-s2.0-51149133856
"McCarrison, R.",23077533900,Further experimental researches on the etiology of endemic goitre,1911,Annals of Tropical Medicine and Parasitology,5,1,,1,14,,,10.1080/00034983.1911.11686338,https://www.scopus.com/inward/record.url?eid=2-s2.0-84975010534&partnerID=40&md5=9c5bd5655cff59e1f2877e534463b563,Article,Final,,Scopus,2-s2.0-84975010534
"Harris, G.C.",57066128000,Spun silk sewing thread counts,1911,Journal of the Textile Institute Proceedings and Abstracts,2,2,,160,,,,10.1080/00405001108631719,https://www.scopus.com/inward/record.url?eid=2-s2.0-84954867566&partnerID=40&md5=285f2a61db369398951e8ab761b8ed27,Article,Final,,Scopus,2-s2.0-84954867566
"Bomford, T.",56907822900,THE RIGHT ANGLE OF APPROACH,1911,The Muslim World,1,3,,283,288,,,10.1111/j.1478-1913.1911.tb00034.x,https://www.scopus.com/inward/record.url?eid=2-s2.0-84944486888&partnerID=40&md5=51747f2cac1172280331739c0fcd0db2,Article,Final,,Scopus,2-s2.0-84944486888
"Weitbrecht, H.U.",56907875600,THE LUCKNOW CONFERENCE,1911,The Muslim World,1,2,,164,175,,1,10.1111/j.1478-1913.1911.tb00018.x,https://www.scopus.com/inward/record.url?eid=2-s2.0-84937435498&partnerID=40&md5=a6718a95b32f9085115efbe95743b8c7,Article,Final,,Scopus,2-s2.0-84937435498
"Adie, H.A.",24752677900,Note on the sex of mosquito larvae,1912,Annals of Tropical Medicine and Parasitology,6,4,,463,466,,,10.1080/00034983.1912.11687086,https://www.scopus.com/inward/record.url?eid=2-s2.0-84974990645&partnerID=40&md5=54bc06309f6e7291b0ad59d314a1b425,Article,Final,,Scopus,2-s2.0-84974990645
"Grifwold, H.D.",57190358443,THE AHMADIYA MOVEMENT,1912,The Muslim World,2,4,,373,379,,,10.1111/j.1478-1913.1912.tb00161.x,https://www.scopus.com/inward/record.url?eid=2-s2.0-84979315010&partnerID=40&md5=6367900a4996706bc56b1aed6d935acd,Article,Final,,Scopus,2-s2.0-84979315010
"Pennell, T.I.",57190355728,ISLAM IN AFGHANlSTAN,1912,The Muslim World,2,2,,133,143,,,10.1111/j.1478-1913.1912.tb00129.x,https://www.scopus.com/inward/record.url?eid=2-s2.0-84979309498&partnerID=40&md5=cc4be2e89c488438ac6df934a7458471,Article,Final,,Scopus,2-s2.0-84979309498
"Stephenson, J.",57151947100,II.—On some littoral Oligochæta of the Clyde,1912,Transactions of the Royal Society of Edinburgh,48,1,,31,65,,8,10.1017/S0080456800018755,https://www.scopus.com/inward/record.url?eid=2-s2.0-84974239009&partnerID=40&md5=f36a53d6479fb0642110fbc69201bdaf,Article,Final,,Scopus,2-s2.0-84974239009
"Stephenson, J.",57151947100,I.—The Nemertines of Millport and its Vicinity,1912,Transactions of the Royal Society of Edinburgh,48,1,,1,29,,12,10.1017/S0080456800018743,https://www.scopus.com/inward/record.url?eid=2-s2.0-84974224049&partnerID=40&md5=55b69c880c8255741986ea810c7e1d1b,Article,Final,,Scopus,2-s2.0-84974224049
"Stephenson, J.",57151947100,"XV.—On Branchiura sowerbyi Beddard, and on a new species of Limnodrilus with distinctive characters",1912,Transactions of the Royal Society of Edinburgh,48,2,,285,303,,4,10.1017/S0080456800002878,https://www.scopus.com/inward/record.url?eid=2-s2.0-84934017818&partnerID=40&md5=fc5db5fc3150e25bbbf97bb26036bfd6,Article,Final,,Scopus,2-s2.0-84934017818
"Stephenson, J.",57151947100,XIV.— Intestinal Respiration in Annelids; with Considerations on the Origin and Evolution of the Vascular System in that Group,1913,Transactions of the Royal Society of Edinburgh,49,3,,735,829,,3,10.1017/S0080456800013168,https://www.scopus.com/inward/record.url?eid=2-s2.0-84974265592&partnerID=40&md5=be5bac60404844e377f8f5232363596b,Article,Final,,Scopus,2-s2.0-84974265592
"Newell, A.G.",24753340100,The etiology of blackwater fever,1913,Transactions of the Royal Society of Tropical Medicine and Hygiene,6,5,,177,181,,,10.1016/S0035-9203(13)90130-9,https://www.scopus.com/inward/record.url?eid=2-s2.0-50749121626&partnerID=40&md5=fce08182bcfcdbed7d973f3b18d9d6e4,Article,Final,,Scopus,2-s2.0-50749121626
"Porter, R.R.M.",57189126261,Heart-block in a case of pneumonia,1914,British Medical Journal,1,2781,,858,,,,10.1136/bmj.1.2781.858,https://www.scopus.com/inward/record.url?eid=2-s2.0-84965247554&partnerID=40&md5=5d073dda7499d0fa0732fbedebef76ad,Article,Final,,Scopus,2-s2.0-84965247554
"Kashyap, S.R.",36520604700,MORPHOLOGICAL AND BIOLOGICAL NOTES ON NEW AND LITTLE?KNOWN WEST?HIMALAYAN LIVERWORTS. II.,1914,New Phytologist,13,9,,308,323,,6,10.1111/j.1469-8137.1914.tb05760.x,https://www.scopus.com/inward/record.url?eid=2-s2.0-32044467226&partnerID=40&md5=83a3633f368dc69a74bc048958d1ab40,Article,Final,Open Access,Scopus,2-s2.0-32044467226
"Kashyap, S.R.",36520604700,MORPHOLOGICAL AND BIOLOGICAL NOTES ON NEW AND LITTLE KNOWN WEST?HIMALAYAN LIVERWORTS. I.,1914,New Phytologist,13,7-Jun,,206,226,,8,10.1111/j.1469-8137.1914.tb05751.x,https://www.scopus.com/inward/record.url?eid=2-s2.0-1842545187&partnerID=40&md5=dcd6b0be3ef88fc3f662d09b9d1246e2,Article,Final,Open Access,Scopus,2-s2.0-1842545187
"Walter., H.A.",57190358833,IV. INDIA,1915,The Muslim World,5,1,,16,19,,,10.1111/j.1478-1913.1915.tb01418.x,https://www.scopus.com/inward/record.url?eid=2-s2.0-84979309554&partnerID=40&md5=63f7e2f9b49e4ec1873dfd6c2cc38c65,Article,Final,,Scopus,2-s2.0-84979309554
"Gilbert, L.E.",57189979817,The application of strong antiseptics to infected and non-infected wounds,1915,British Medical Journal,1,2839,,950,,,,10.1136/bmj.1.2839.950-a,https://www.scopus.com/inward/record.url?eid=2-s2.0-84975927558&partnerID=40&md5=e8b811adef9fcc6d7ee3f8a08c9fc25d,Letter,Final,,Scopus,2-s2.0-84975927558
"Kashyap, S.R.",36520604700,MORPHOLOGICAL AND BIOLOGICAL NOTES ON NEW AND LITTLE KNOWN WEST?HIMALAYAN LIVERWORTS. III,1915,New Phytologist,14,1,,1,18,,9,10.1111/j.1469-8137.1915.tb07159.x,https://www.scopus.com/inward/record.url?eid=2-s2.0-0012643729&partnerID=40&md5=7691471abba55d0474d999f780a8d83e,Article,Final,Open Access,Scopus,2-s2.0-0012643729
"Cotton, F.W.",57189128722,The soldier's heart,1916,British Medical Journal,2,2912,,571,572,,,10.1136/bmj.2.2912.571-a,https://www.scopus.com/inward/record.url?eid=2-s2.0-84965243836&partnerID=40&md5=4b9362d2aba2be882f8051fc1a9eee31,Letter,Final,,Scopus,2-s2.0-84965243836
"BRENTON?CAREY, B.",57190357320,MOSLEM WOMEN IN SINDH,1916,The Muslim World,6,2,,175,178,,,10.1111/j.1478-1913.1916.tb02289.x,https://www.scopus.com/inward/record.url?eid=2-s2.0-84979327552&partnerID=40&md5=d6cfee85e1d2e6789edd0aa00b0e03b8,Article,Final,,Scopus,2-s2.0-84979327552
"Stephenson, J.",57151947100,XXI.—On a rule of proportion observed in the setæ of certain Naididæ,1916,Transactions of the Royal Society of Edinburgh,50,4,,783,788,,,10.1017/S008045680001704X,https://www.scopus.com/inward/record.url?eid=2-s2.0-84974506005&partnerID=40&md5=4b31679fc83e38d3d358213af5900e72,Article,Final,,Scopus,2-s2.0-84974506005
"Stephenson, J.",57151947100,XXII.—On the sexual phase in certain of the naididæ. I. The anatomy of sexual individuals of the genus dero; with remarks on hæmonais. II. The genital organs in the genus slavina,1916,Transactions of the Royal Society of Edinburgh,50,4,,789,795,,,10.1017/S0080456800017051,https://www.scopus.com/inward/record.url?eid=2-s2.0-84974267707&partnerID=40&md5=bc6c8113523538cebc0186f70a0aeac8,Article,Final,,Scopus,2-s2.0-84974267707
"CONVERT, A.I.",57190355718,HOW CHRIST WON MY HEART,1916,The Muslim World,6,1,,79,81,,1,10.1111/j.1478-1913.1916.tb01485.x,https://www.scopus.com/inward/record.url?eid=2-s2.0-84895026238&partnerID=40&md5=9d5711d2d2d80e3f566ef477db6683a2,Article,Final,,Scopus,2-s2.0-84895026238
"Stephenson, J.",57151947100,"XX.—On Hæmonais laurentii, n. sp., a Representative of a little-known Genus of Naididæ",1916,Transactions of the Royal Society of Edinburgh,50,4,,769,781,,1,10.1017/S0080456800017038,https://www.scopus.com/inward/record.url?eid=2-s2.0-0141536794&partnerID=40&md5=d7fb181dd4f58dad191e45de30fe452f,Article,Final,,Scopus,2-s2.0-0141536794
"Dunnicliff, H.B., Lal, S.",16065455500; 23078108400,LXIV. - The basic carbonates of copper,1918,"Journal of the Chemical Society, Transactions",113,,,718,722,,,10.1039/CT9181300718,https://www.scopus.com/inward/record.url?eid=2-s2.0-37049157197&partnerID=40&md5=7880c77bc93322180e0efce6d9a65ec7,Review,Final,,Scopus,2-s2.0-37049157197
"Bhatia, B.L., Prashad, B.",57190461190; 24770589100,Skull of Rana tigrina Daud,1918,Proceedings of the Zoological Society of London,88,2-Jan,,1,8,,1,10.1111/j.1096-3642.1918.tb02073.x,https://www.scopus.com/inward/record.url?eid=2-s2.0-84980094862&partnerID=40&md5=dfaa3817e3eae04a87e298b523b39896,Article,Final,,Scopus,2-s2.0-84980094862
"Stephenson, J.H., Ram, H.",57189454915; 57189450364,XVI.—The Prostate Glands of the Earthworms of the Family Megascolecidæ,1919,Transactions of the Royal Society of Edinburgh,52,2,,435,453,,,10.1017/S0080456800012175,https://www.scopus.com/inward/record.url?eid=2-s2.0-84971138764&partnerID=40&md5=b550c51ea21c68bdc3c0f9225e48fb49,Article,Final,,Scopus,2-s2.0-84971138764
"Kashyap, S.R.",36520604700,THE ANDROECIUM IN PLAGIOCHASMA APPENDICULATUM L. ET L. AND P. ARTICULATUM KASHYAP.,1919,New Phytologist,18,7,,235,235,,,10.1111/j.1469-8137.1919.tb07301.x,https://www.scopus.com/inward/record.url?eid=2-s2.0-84980099842&partnerID=40&md5=9761260fbbf4a3afa9229f567d3ac203,Article,Final,Open Access,Scopus,2-s2.0-84980099842
"ANDERSON, W.T.",57190356109,REAPING THE HARVEST TO?DAY.,1919,The Muslim World,9,1,,65,67,,,10.1111/j.1478-1913.1919.tb01750.x,https://www.scopus.com/inward/record.url?eid=2-s2.0-84980097747&partnerID=40&md5=8131cb9f5dcd802a6f04f8be890dc260,Article,Final,,Scopus,2-s2.0-84980097747
"Campbell, A.",57198631598,Two cases with cerebellar symptoms,1919,"The Journal of Laryngology, Rhinology, and Otology",34,3,,76,80,,,10.1017/S1755146300019259,https://www.scopus.com/inward/record.url?eid=2-s2.0-84973955260&partnerID=40&md5=95ff6604a1323ab749945c9f1d1b23b3,Article,Final,,Scopus,2-s2.0-84973955260
"DIN, R.S.U., WALTER, H.A.",57190456633; 57190358833,AN INDIAN SUFI HYMN,1919,The Muslim World,9,2,,122,131,,1,10.1111/j.1478-1913.1919.tb01757.x,https://www.scopus.com/inward/record.url?eid=2-s2.0-84925065977&partnerID=40&md5=233db8a4a6cba60db0cb29e7636f178f,Article,Final,,Scopus,2-s2.0-84925065977
"WALTER, M.B.",57190460381,THE ALL INDIA MOSLEM LADIES CONFERENCE,1919,The Muslim World,9,2,,169,175,,1,10.1111/j.1478-1913.1919.tb01764.x,https://www.scopus.com/inward/record.url?eid=2-s2.0-79956122008&partnerID=40&md5=fc73cbd11ffab571801e5001f66b46b7,Article,Final,,Scopus,2-s2.0-79956122008
"Stephenson, J.B., Prashad, B.",57151947100; 24770589100,XVII.—The Calciferous Glands of Earthworms,1919,Transactions of the Royal Society of Edinburgh,52,2,,455,485,,,10.1017/S0080456800012187,https://www.scopus.com/inward/record.url?eid=2-s2.0-84971128406&partnerID=40&md5=69fe914939c0bc03760f8a6238ab4feb,Article,Final,,Scopus,2-s2.0-84971128406
"Bhatnagar, S.S.",55429686600,The effect of adsorbed gases on the surface tension of water,1920,Journal of Physical Chemistry,24,9,,716,735,,2,,https://www.scopus.com/inward/record.url?eid=2-s2.0-33947484435&partnerID=40&md5=91d92e8d659e30b6866c95ea4b4a81bb,Article,Final,,Scopus,2-s2.0-33947484435
"Bhatia, B.L.",57190461189,TRANSACTIONS OF THE SOCIETY.: VII.—Notes on Fresh?water Ciliate Protozoa of India,1920,Journal of the Royal Microscopical Society,40,3,,257,267,,,10.1111/j.1365-2818.1920.tb00760.x,https://www.scopus.com/inward/record.url?eid=2-s2.0-84980094584&partnerID=40&md5=e50cc6cad81e4320bf31f2b1aa8ed34d,Article,Final,,Scopus,2-s2.0-84980094584
"Boulenger, C.L.",57128999500,On some filariid parasites of cattle and other ruminants,1920,Parasitology,12,4,,341,349,,4,10.1017/S0031182000014335,https://www.scopus.com/inward/record.url?eid=2-s2.0-84959700340&partnerID=40&md5=6d6cb938450eafa3add5d1ec56334b46,Article,Final,,Scopus,2-s2.0-84959700340
"Singh, B.K., Singh, D., Dutt, G., Singh, G.",57207053263; 57198857168; 23076604000; 23078814800,CVIII. - Studies on the dependence of optical rotatory power on chemical constitution. Part II. The effect of position-isomerism and conjugation on optical activity among aryl derivatives of amino- and bisimino-camphor,1920,"Journal of the Chemical Society, Transactions",117,,,980,988,,,10.1039/CT9201700980,https://www.scopus.com/inward/record.url?eid=2-s2.0-37049172866&partnerID=40&md5=31a0bf2e7ff0415e03760887cee49b18,Review,Final,,Scopus,2-s2.0-37049172866
"Singh, B.K.",57207053263,"CXXXI. - Studies in substituted quaternary azonium compounds containing an asymmetric nitrogen atom. Part III. Resolution of phenylmethylethylazonium, phenylbenzylpropylazonium, and phenylbenzylallylazonium iodides into optically active components",1920,"Journal of the Chemical Society, Transactions",117,,,1202,1214,,1,10.1039/CT9201701202,https://www.scopus.com/inward/record.url?eid=2-s2.0-37049163412&partnerID=40&md5=f42a60602ad02ff103392d76d84b4fbf,Review,Final,,Scopus,2-s2.0-37049163412
"Singh, B.K., Singh, M.",57207053263; 23078192400,CLXXVIII. - Studies on the dependence of optical rotatory power on chemical constitution. Part III. 1:4-Naphthylenebisiminocamphor,1920,"Journal of the Chemical Society, Transactions",117,,,1599,1601,,,10.1039/CT9201701599,https://www.scopus.com/inward/record.url?eid=2-s2.0-37049159439&partnerID=40&md5=698169f5fc41cae5936f165b281d7de0,Article,Final,,Scopus,2-s2.0-37049159439
"Boulenger, C.L.",57128999500,"31. Filariid Worms from Mammals and Birds in the Society's Gardens, 1914–1915.",1920,Proceedings of the Zoological Society of London,90,4,,491,505,,4,10.1111/j.1096-3642.1920.tb03242.x,https://www.scopus.com/inward/record.url?eid=2-s2.0-0347268049&partnerID=40&md5=599c48ea1ad4101bcde89e37f94e2cc9,Article,Final,,Scopus,2-s2.0-0347268049
"IMMS, A.D., HUSAIN, M.A.",24593602400; 56945206900,FIELD EXPERTMENTS ON THE CHEMOTROPIC RESPONSES OF INSECTS,1920,Annals of Applied Biology,6,4,,269,292,,,10.1111/j.1744-7348.1920.tb06473.x,https://www.scopus.com/inward/record.url?eid=2-s2.0-84946386398&partnerID=40&md5=7d6e9dca50d5614bfbd9c9c95866380b,Article,Final,,Scopus,2-s2.0-84946386398
"Hemmy, A.S.",55279009500,The flow of viscous liquids through slightly conical tubes,1921,Proceedings of the Physical Society of London,34,1,304,22,26,,,10.1088/1478-7814/34/1/304,https://www.scopus.com/inward/record.url?eid=2-s2.0-36149071858&partnerID=40&md5=33efb3a8795f284bf66c93ac54e16b58,Article,Final,,Scopus,2-s2.0-36149071858
"Benade, J.M.",22987279200,Thermoelectric electric effects in iron and mercury due to asymmetric heating,1921,Physical Review,18,3,,199,205,,,10.1103/PhysRev.18.199,https://www.scopus.com/inward/record.url?eid=2-s2.0-36149022523&partnerID=40&md5=320cd3024eb810d23ae1d37c41b01d23,Article,Final,,Scopus,2-s2.0-36149022523
"Bhatia, B.L.",57190461189,III.—Notes on Fresh?Water Ciliate Protozoa of India.—II,1922,Journal of the Royal Microscopical Society,42,1,,27,36,,,10.1111/j.1365-2818.1922.tb01143.x,https://www.scopus.com/inward/record.url?eid=2-s2.0-84980094557&partnerID=40&md5=44af5a292768d2234926a1b152589956,Article,Final,,Scopus,2-s2.0-84980094557
"BRENCHLEY, W.E., SINGH, K.",24826923400; 56945135200,EFFECT OF HIGH ROOT TEMPERATURE AND EXCESSIVE INSOLATION UPON GROWTH.,1922,Annals of Applied Biology,9,4-Mar,,197,209,,,10.1111/j.1744-7348.1922.tb05955.x,https://www.scopus.com/inward/record.url?eid=2-s2.0-84946390053&partnerID=40&md5=d9cac7be879f5517e633821a96e35dbc,Article,Final,,Scopus,2-s2.0-84946390053
"Vaughan, K.",55563739000,The treatment of non-malignant affections of the colon,1923,British Medical Journal,1,3241,,259,,,,10.1136/bmj.1.3241.259,https://www.scopus.com/inward/record.url?eid=2-s2.0-84965230844&partnerID=40&md5=39ffbd6b872bdfd8a1783a5f407d3e73,Letter,Final,,Scopus,2-s2.0-84965230844
"Wood, J.A.",57199230077,Reality proved by Identity: A Study in Evidence for the Historical Truth of the Gospels,1923,The Expository Times,35,2,,54,59,,,10.1177/001452462303500202,https://www.scopus.com/inward/record.url?eid=2-s2.0-84970656235&partnerID=40&md5=a7a2f693aa1940b0ad3b295ffddd475e,Article,Final,,Scopus,2-s2.0-84970656235
"Bhatia, B.L.",24771280000,A new Gregarine parasite of Leptoplana [10],1923,Nature,111,2778,,116,,,,10.1038/111116d0,https://www.scopus.com/inward/record.url?eid=2-s2.0-51149201425&partnerID=40&md5=d84d4cd29ff88a606b9008bf959ca91e,Letter,Final,,Scopus,2-s2.0-51149201425
"Dunnicliff, H.B.",16065455500,LXXXVI. - The hydrogen sulphates of the alkali metals and ammonium,1923,"Journal of the Chemical Society, Transactions",123,,,731,738,,,10.1039/CT9232300731,https://www.scopus.com/inward/record.url?eid=2-s2.0-37049176437&partnerID=40&md5=edb165629872528398a86ea910996cf7,Article,Final,,Scopus,2-s2.0-37049176437
"Dunnicliff, H.B.",16065455500,LX.- the action of alcohol on the sulphates of ammonium,1923,"Journal of the Chemical Society, Transactions",123,,,476,484,,,10.1039/CT9232300476,https://www.scopus.com/inward/record.url?eid=2-s2.0-37049156951&partnerID=40&md5=dec69aefb6966ea3715512203ae6fb77,Article,Final,,Scopus,2-s2.0-37049156951
"Sondhi, G.",57189672334,Tapeworm parasites of dogs in the punjab,1923,Parasitology,15,1,,59,66,,1,10.1017/S0031182000014529,https://www.scopus.com/inward/record.url?eid=2-s2.0-2542621622&partnerID=40&md5=c8c3a54e9fb7ad82aaf950b998f584b8,Article,Final,,Scopus,2-s2.0-2542621622
"Lorimer, D.L.R.",56951515700,Notes on the Phonetics of the Gilgit Dialect of Shina,1924,Journal of the Royal Asiatic Society of Great Britain &amp; Ireland,56,2,,177,212,,,10.1017/S0035869X00064005,https://www.scopus.com/inward/record.url?eid=2-s2.0-84973988929&partnerID=40&md5=20159b0545d349f518e1af002017a020,Article,Final,,Scopus,2-s2.0-84973988929
"Wilsdon, B.H.",23079100200,A physical theory of soil moisture relations,1924,The Journal of Agricultural Science,14,4,,473,489,,,10.1017/S0021859600003907,https://www.scopus.com/inward/record.url?eid=2-s2.0-84958446587&partnerID=40&md5=626bd0c48ab160a600643f7a79aa4b15,Article,Final,,Scopus,2-s2.0-84958446587
"Dunnicliff, H.B.",16065455500,Note. the estimation of carbonates in highly coloured liquids,1924,The Analyst,49,582,,426,428,,,10.1039/AN9244900426,https://www.scopus.com/inward/record.url?eid=2-s2.0-37049160217&partnerID=40&md5=399025bedf04145bf4a0d18e7d49d8c7,Article,Final,,Scopus,2-s2.0-37049160217
"Bhatia, B.L., Setna, S.",24771280000; 35935772000,On some new cephaline gregarines,1924,Parasitology,16,3,,279,288,,12,10.1017/S0031182000020114,https://www.scopus.com/inward/record.url?eid=2-s2.0-0037661826&partnerID=40&md5=0b715bf2f0c3f65d9e01d70ab1630d81,Article,Final,,Scopus,2-s2.0-0037661826
"Singh, M., Singh, R.",23078192400; 37041395300,CCLXIII. - Carboxycamphoranilic acids,1925,"Journal of the Chemical Society, Transactions",127,,,1966,1968,,,10.1039/CT9252701966,https://www.scopus.com/inward/record.url?eid=2-s2.0-37049175473&partnerID=40&md5=600b5f720896b1819ec2d2d02f4976b9,Article,Final,,Scopus,2-s2.0-37049175473
"Chambers, C.B.G.",57190456308,THE FRONTIERS OF AFGHANISTAN,1925,The Muslim World,15,3,,240,253,,,10.1111/j.1478-1913.1925.tb00573.x,https://www.scopus.com/inward/record.url?eid=2-s2.0-84980095139&partnerID=40&md5=b44a3560ef9104ae202c8760dfdea96c,Article,Final,,Scopus,2-s2.0-84980095139
"Seth, J.B.",16653078100,A method of determining the frequency of a tuning fork [8],1925,Nature,115,2896,,641,,,,10.1038/115641a0,https://www.scopus.com/inward/record.url?eid=2-s2.0-51149184661&partnerID=40&md5=3b8525045ed06eb6e7fc3025d496cdfd,Letter,Final,,Scopus,2-s2.0-51149184661
"Dunnicliff, H.B.",16065455500,The determination of sulphates in guncotton,1925,The Analyst,50,596,,543,547,,3,10.1039/AN9255000543,https://www.scopus.com/inward/record.url?eid=2-s2.0-37049149701&partnerID=40&md5=366c641850b01d250bba76de3ff21d04,Conference Paper,Final,,Scopus,2-s2.0-37049149701
"Jajnik, N.A., Ilahi, B.",16664746100; 16664742000,Das Emulgierungsvermögen von Natriumstearat und Natriumpalmitat,1925,Kolloid-Zeitschrift,37,3,,139,144,,,10.1007/BF01433153,https://www.scopus.com/inward/record.url?eid=2-s2.0-34347105946&partnerID=40&md5=131d0bd87cebeb84d7e5a030ae4ab143,Article,Final,,Scopus,2-s2.0-34347105946
